{
  "schemaVersion": 1,
  "id": "hub.mcp-echo",
  "kind": "extension",
  "name": "MCP Echo",
  "summary": "Minimal local stdio MCP server exposing one echo tool; the reference end-to-end install target for the OpenAR extension hub.",
  "i18n": {
    "zh-CN": "极简本地 stdio MCP 服务器，仅提供一个 echo 工具；OpenAR 扩展中心的端到端安装参考对象。",
    "ja": "echo ツールひとつだけを提供する最小のローカル stdio MCP サーバー。OpenAR 拡張ハブのエンドツーエンド・インストールの参照対象。",
    "ko": "echo 도구 하나만 제공하는 최소 로컬 stdio MCP 서버. OpenAR 확장 허브의 엔드투엔드 설치 참조 대상.",
    "es": "Servidor MCP stdio local mínimo con una sola herramienta de eco; objetivo de referencia para la instalación de extremo a extremo del hub de extensiones de OpenAR."
  },
  "authors": [
    {
      "name": "HuieL",
      "github": "HuieL"
    }
  ],
  "registrySubmitter": "HuieL",
  "categories": [
    "mcp"
  ],
  "source": {
    "repo": "https://github.com/HuieL/OpenAR-extension-hub",
    "path": "entries/extensions/hub.mcp-echo/package",
    "revision": "76957d4585c52d8db9f38d55a89de8396c773d88"
  },
  "version": "1.0.2",
  "license": "MIT",
  "licenseFile": "LICENSE",
  "review": {
    "status": "unreviewed"
  },
  "compat": {
    "minHost": "0.3.0",
    "hostApi": 1,
    "platforms": [
      "macos",
      "linux"
    ]
  },
  "delivery": "mcp-local",
  "integration": "L0",
  "capabilities": [],
  "uiContributions": [],
  "bindings": [
    {
      "kind": "mcp",
      "tool": "echo",
      "inputSchemaDigest": "54669b5e6a1bfebb4d15788d41b5cd5fb8e51fc2d982eb2383a42262c748c90a",
      "outputSchemaDigest": "d95b00b27ca2bbbe11efb4ebcf3e4ee4d61036c801831bccac81b321af6737e5"
    }
  ],
  "assets": [
    {
      "platform": "macos",
      "url": "https://raw.githubusercontent.com/HuieL/OpenAR-extension-hub/76957d4585c52d8db9f38d55a89de8396c773d88/entries/extensions/hub.mcp-echo/package/hub.mcp-echo-1.0.2.zip",
      "sha256": "90c7a14f14cfe722358bac0e70b11da507557c1969ad0d7adf3daee1cb91d925",
      "bytes": 2373
    },
    {
      "platform": "linux",
      "url": "https://raw.githubusercontent.com/HuieL/OpenAR-extension-hub/76957d4585c52d8db9f38d55a89de8396c773d88/entries/extensions/hub.mcp-echo/package/hub.mcp-echo-1.0.2.zip",
      "sha256": "90c7a14f14cfe722358bac0e70b11da507557c1969ad0d7adf3daee1cb91d925",
      "bytes": 2373
    }
  ],
  "mcp": {
    "transport": "stdio",
    "command": [
      "server/echo.py"
    ],
    "version": "1.0.2",
    "env": []
  }
}
